{
  "mappings": {
    "dynamic": true
  },
  "analyzer": "builtinAnalyzer",
  "searchAnalyzer": "luceneAnalyzer",
  "analyzers": [
    {
      "name": "builtinAnalyzer",
      "tokenizer": {
        "type": "standard"
      },
      "tokenFilters": [
        {
          "type": "lowercase"
        }
      ]
    },
    {
      "name": "luceneAnalyzer",
      "tokenizer": {
        "type": "whitespace"
      },
      "charFilters": [
        {
          "type": "mapping",
          "mappings": {
            "a": ""
          }
        }
      ]
    }
  ]
}
